{
  "plan_id": "plan-2-1-593994f4",
  "title": "景德镇2天1晚旅行计划",
  "city": "景德镇",
  "days": 2,
  "profile_id": "realRoc",
  "travel_mode": "companion",
  "nights": 1,
  "themes": [
    "pottery",
    "coffee"
  ],
  "source_refs": [
    "imports/manual/raw/src-0ac5dd64.md",
    "imports/manual/raw/src-2ea1e8a6.md",
    "imports/manual/raw/src-3cc57481.md",
    "imports/manual/raw/src-e26e779e.md",
    "imports/manual/raw/src-f94bc2d3.md"
  ],
  "place_ids": [
    "place-bffae579",
    "place-34219221",
    "place-f15a3b2a",
    "place-83179bb4",
    "place-7fdafa02"
  ],
  "plan_notes": [
    "按画像偏好尽量午后启动，建议 12:00 后出门。",
    "按画像偏好保持轻松节奏，避免高密度连打卡。",
    "按画像偏好保留夜市、夜游或夜间散步时段。",
    "住宿偏好：优先品牌 Atour；最低 4 星。",
    "结伴出行时，住宿至少亚朵或四星级以上。",
    "结伴出行默认不排早起，尽量把节奏做松，晚上可以安排夜市、夜游或街区散步。"
  ],
  "itinerary": [
    {
      "day": 1,
      "summary": "马尾港 -> 三宝村 -> 陶溪川文创街区",
      "items": [
        {
          "slot": "lunch",
          "place_id": "place-bffae579",
          "name": "马尾港",
          "district": "珠山区",
          "category": "restaurant",
          "duration_min": 90,
          "reason": "多篇攻略在标签区都会带上马尾港，属于被重复提到的景德镇吃饭点，可以作为首版计划里的晚餐备选。"
        },
        {
          "slot": "afternoon",
          "place_id": "place-34219221",
          "name": "三宝村",
          "district": "珠山区",
          "category": "walk",
          "duration_min": 120,
          "reason": "攻略笔记把三宝村放在 Day1 起点，另一篇旅行反馈也把它列为景德镇代表性打卡点，适合作为周末行程的轻松开场。"
        },
        {
          "slot": "evening",
          "place_id": "place-f15a3b2a",
          "name": "陶溪川文创街区",
          "district": "珠山区",
          "category": "market",
          "duration_min": 120,
          "reason": "夜游指南明确把陶溪川定义为亮灯后最值得逛的地方，市集按伞色分区；另一篇选址攻略则建议白天雕塑瓷厂、晚上陶溪川，组合最顺。"
        }
      ]
    },
    {
      "day": 2,
      "summary": "明清园市集 -> 景德镇中国陶瓷博物馆",
      "items": [
        {
          "slot": "lunch",
          "place_id": "place-83179bb4",
          "name": "明清园市集",
          "district": "珠山区",
          "category": "market",
          "duration_min": 90,
          "reason": "市集指南把明清园市集定义为传统与现代工艺融合的去处，偏传统瓷器，也适合顺路了解工艺背景。"
        },
        {
          "slot": "afternoon",
          "place_id": "place-7fdafa02",
          "name": "景德镇中国陶瓷博物馆",
          "district": "昌江区",
          "category": "museum",
          "duration_min": 120,
          "reason": "多篇攻略把陶瓷博物馆列入核心日间行程，美食和手作体验类笔记也都明确提到“博物馆值得打卡”。"
        }
      ]
    }
  ],
  "created_at": "2026-03-25T05:54:43Z",
  "updated_at": "2026-03-25T05:54:43Z"
}
