{
  "plan_id": "plan-2-1-67278512",
  "title": "景德镇2天1晚旅行计划（实采版）",
  "city": "景德镇",
  "days": 2,
  "nights": 1,
  "themes": [],
  "source_refs": [
    "imports/manual/raw/src-0ac5dd64.md",
    "imports/manual/raw/src-10504ce3.md",
    "imports/manual/raw/src-3cc57481.md",
    "imports/manual/raw/src-e26e779e.md",
    "imports/manual/raw/src-f4dbd357.md",
    "imports/manual/raw/src-f94bc2d3.md",
    "imports/manual/raw/src-fde285d8.md",
    "imports/xiaohongshu/raw/xhs-batch-jingdezhen-live-20260325-492988dc.json"
  ],
  "place_ids": [
    "place-34219221",
    "place-f88047dc",
    "place-cf2f2f32",
    "place-f15a3b2a",
    "place-7fdafa02",
    "place-bffae579",
    "place-64a3ae42"
  ],
  "itinerary": [
    {
      "day": 1,
      "summary": "三宝村 -> 雕塑瓷厂 -> 抚州弄 -> 陶溪川文创街区",
      "items": [
        {
          "slot": "morning",
          "place_id": "place-34219221",
          "name": "三宝村",
          "district": "珠山区",
          "category": "walk",
          "duration_min": 75,
          "reason": "攻略笔记把三宝村放在 Day1 起点，另一篇旅行反馈也把它列为景德镇代表性打卡点，适合作为周末行程的轻松开场。"
        },
        {
          "slot": "afternoon",
          "place_id": "place-f88047dc",
          "name": "雕塑瓷厂",
          "district": "珠山区",
          "category": "market",
          "duration_min": 120,
          "reason": "专门比较雕塑瓷厂和陶溪川的笔记建议白天去雕塑瓷厂，主打可逛可买；咖啡推荐文也把它周边列为咖啡和器具店高密度区域。"
        },
        {
          "slot": "dinner",
          "place_id": "place-cf2f2f32",
          "name": "抚州弄",
          "district": "珠山区",
          "category": "food",
          "duration_min": 90,
          "reason": "旅行反馈帖把抚州弄和陶溪川、御窑片区并列为必去；作为城市小吃密集点，适合放在中午或傍晚。"
        },
        {
          "slot": "evening",
          "place_id": "place-f15a3b2a",
          "name": "陶溪川文创街区",
          "district": "珠山区",
          "category": "market",
          "duration_min": 120,
          "reason": "夜游指南明确把陶溪川定义为亮灯后最值得逛的地方，市集按伞色分区；另一篇选址攻略则建议白天雕塑瓷厂、晚上陶溪川，组合最顺。"
        }
      ]
    },
    {
      "day": 2,
      "summary": "景德镇中国陶瓷博物馆 -> 马尾港 -> 陶阳里历史文化旅游区",
      "items": [
        {
          "slot": "morning",
          "place_id": "place-7fdafa02",
          "name": "景德镇中国陶瓷博物馆",
          "district": "昌江区",
          "category": "museum",
          "duration_min": 75,
          "reason": "多篇攻略把陶瓷博物馆列入核心日间行程，美食和手作体验类笔记也都明确提到“博物馆值得打卡”。"
        },
        {
          "slot": "lunch",
          "place_id": "place-bffae579",
          "name": "马尾港",
          "district": "珠山区",
          "category": "restaurant",
          "duration_min": 90,
          "reason": "多篇攻略在标签区都会带上马尾港，属于被重复提到的景德镇吃饭点，可以作为首版计划里的晚餐备选。"
        },
        {
          "slot": "afternoon",
          "place_id": "place-64a3ae42",
          "name": "陶阳里历史文化旅游区",
          "district": "珠山区",
          "category": "attraction",
          "duration_min": 120,
          "reason": "路线型攻略把陶阳里与御窑景巷串成一段连续动线，旅行反馈帖也把陶阳里景区和御窑博物馆并列为核心打卡点。"
        }
      ]
    }
  ],
  "created_at": "2026-03-25T05:40:34Z",
  "updated_at": "2026-03-25T05:40:34Z"
}
